No.     Time           Source                Destination           Protocol Length Info
      7 3.181669000    192.168.0.16          128.119.245.12        HTTP     433    GET /wireshark-labs/HTTP-wireshark-file1.html HTTP/1.1 

Frame 7: 433 bytes on wire (3464 bits), 433 bytes captured (3464 bits) on interface 0
Ethernet II, Src: Apple_8f:e7:b7 (d8:a2:5e:8f:e7:b7), Dst: Netgear_4c:ec:47 (30:46:9a:4c:ec:47)
Internet Protocol Version 4, Src: 192.168.0.16 (192.168.0.16), Dst: 128.119.245.12 (128.119.245.12)
Transmission Control Protocol, Src Port: 51672 (51672), Dst Port: http (80), Seq: 1, Ack: 1, Len: 367
Hypertext Transfer Protocol
    GET /wireshark-labs/HTTP-wireshark-file1.html HTTP/1.1\r\n
    Host: gaia.cs.umass.edu\r\n
    User-Agent: Mozilla/5.0 (Macintosh; Intel Mac OS X 10_6_8) AppleWebKit/534.57.2 (KHTML, like Gecko) Version/5.1.7 Safari/534.57.2\r\n
    Accept: text/html,application/xhtml+xml,application/xml;q=0.9,*/*;q=0.8\r\n
    Accept-Language: en-us\r\n
    Accept-Encoding: gzip, deflate\r\n
    Connection: keep-alive\r\n
    \r\n
    [Full request URI: http://gaia.cs.umass.edu/wireshark-labs/HTTP-wireshark-file1.html]

No.     Time           Source                Destination           Protocol Length Info
      9 3.285005000    128.119.245.12        192.168.0.16          HTTP     494    HTTP/1.1 200 OK  (text/html)

Frame 9: 494 bytes on wire (3952 bits), 494 bytes captured (3952 bits) on interface 0
Ethernet II, Src: Netgear_4c:ec:47 (30:46:9a:4c:ec:47), Dst: Apple_8f:e7:b7 (d8:a2:5e:8f:e7:b7)
Internet Protocol Version 4, Src: 128.119.245.12 (128.119.245.12), Dst: 192.168.0.16 (192.168.0.16)
Transmission Control Protocol, Src Port: http (80), Dst Port: 51672 (51672), Seq: 1, Ack: 368, Len: 428
Hypertext Transfer Protocol
    HTTP/1.1 200 OK\r\n
    Date: Sun, 17 Mar 2013 13:50:58 GMT\r\n
    Server: Apache/2.2.3 (CentOS)\r\n
    Last-Modified: Sun, 17 Mar 2013 13:50:01 GMT\r\n
    ETag: "8734d-80-260fd440"\r\n
    Accept-Ranges: bytes\r\n
    Content-Length: 128\r\n
    Keep-Alive: timeout=10, max=100\r\n
    Connection: Keep-Alive\r\n
    Content-Type: text/html; charset=UTF-8\r\n
    \r\n
Line-based text data: text/html

No.     Time           Source                Destination           Protocol Length Info
     17 5.504370000    192.168.0.16          74.125.224.201        HTTP     167    POST /safebrowsing/downloads?pver=2.2&client=Safari&appver=5.1.7 HTTP/1.1  (application/x-www-form-urlencoded)

Frame 17: 167 bytes on wire (1336 bits), 167 bytes captured (1336 bits) on interface 0
Ethernet II, Src: Apple_8f:e7:b7 (d8:a2:5e:8f:e7:b7), Dst: Netgear_4c:ec:47 (30:46:9a:4c:ec:47)
Internet Protocol Version 4, Src: 192.168.0.16 (192.168.0.16), Dst: 74.125.224.201 (74.125.224.201)
Transmission Control Protocol, Src Port: 51673 (51673), Dst Port: http (80), Seq: 723, Ack: 1, Len: 101
[2 Reassembled TCP Segments (823 bytes): #16(722), #17(101)]
Hypertext Transfer Protocol
    POST /safebrowsing/downloads?pver=2.2&client=Safari&appver=5.1.7 HTTP/1.1\r\n
    Host: safebrowsing.clients.google.com\r\n
    User-Agent: Mozilla/5.0 (Macintosh; Intel Mac OS X 10_6_8) AppleWebKit/534.57.2 (KHTML, like Gecko) Version/5.1.7 Safari/534.57.2\r\n
    Accept: */*\r\n
    Accept-Language: en-us\r\n
    Accept-Encoding: gzip, deflate\r\n
    Content-Type: application/x-www-form-urlencoded\r\n
    [truncated] Cookie: NID=67=Kwu4V9i0kQ5XJcLA9v-V_3jbjsNLcFgzEWYUzISqKF8-5D8ogqAy3JjxMXzNDzhrUWGUZXkECvVesHTYCHxNVKnBuDJDQ1UDbH34euhj5aLJaI8kooylnFWurLxmA95vbtWYislWPhiOSGkFhg3_iQS5WhalJbyOclVJyu0Bimbf42joTf29V_M87v0; PREF=ID=cbbd647ae68dcc3
    Content-Length: 101\r\n
    Connection: keep-alive\r\n
    \r\n
    [Full request URI: http://safebrowsing.clients.google.com/safebrowsing/downloads?pver=2.2&client=Safari&appver=5.1.7]
Line-based text data: application/x-www-form-urlencoded

No.     Time           Source                Destination           Protocol Length Info
     20 5.559537000    74.125.224.201        192.168.0.16          HTTP     1328   HTTP/1.1 200 OK  (application/vnd.google.safebrowsing-update)

Frame 20: 1328 bytes on wire (10624 bits), 1328 bytes captured (10624 bits) on interface 0
Ethernet II, Src: Netgear_4c:ec:47 (30:46:9a:4c:ec:47), Dst: Apple_8f:e7:b7 (d8:a2:5e:8f:e7:b7)
Internet Protocol Version 4, Src: 74.125.224.201 (74.125.224.201), Dst: 192.168.0.16 (192.168.0.16)
Transmission Control Protocol, Src Port: http (80), Dst Port: 51673 (51673), Seq: 1, Ack: 824, Len: 1262
Hypertext Transfer Protocol
    HTTP/1.1 200 OK\r\n
    Content-Type: application/vnd.google.safebrowsing-update\r\n
    X-Content-Type-Options: nosniff\r\n
    Date: Sun, 17 Mar 2013 13:51:00 GMT\r\n
    Server: HTTP server (unknown)\r\n
    Content-Length: 1000\r\n
    X-XSS-Protection: 1; mode=block\r\n
    X-Frame-Options: SAMEORIGIN\r\n
    \r\n
Media Type
